"DESCRIPTION","DURATION IN MS","NAME","PARENT SUITE","START TIME","STATUS","STOP TIME","SUB SUITE","SUITE","TEST CLASS","TEST METHOD"
"","3578","should display error with empty password @regression","Chromium","Mon Apr 06 01:33:13 CEST 2026","passed","Mon Apr 06 01:33:16 CEST 2026","LoginPage - Validation Tests","tests\loginTests.spec.ts","",""
"","30496","should display error with invalid credentials @regression","Chromium","Mon Apr 06 01:33:16 CEST 2026","broken","Mon Apr 06 01:33:47 CEST 2026","LoginPage - Validation Tests","tests\loginTests.spec.ts","",""
"","11751","should load home page after successful login @smoke","Chromium","Mon Apr 06 01:32:47 CEST 2026","passed","Mon Apr 06 01:32:58 CEST 2026","HomePage - Navigation Tests","tests\homePageTests.spec.ts","",""
"","16791","should create a new tag and verify it appears in the list @smoke @regression","Chromium","Mon Apr 06 01:32:47 CEST 2026","passed","Mon Apr 06 01:33:03 CEST 2026","Templates - Tags Tests","tests\templates\tagsTests.spec.ts","",""
"","30415","should show validation errors when submitting empty user form @regression","Chromium","Mon Apr 06 01:34:53 CEST 2026","broken","Mon Apr 06 01:35:23 CEST 2026","Users - Validation Tests","tests\users\usersTests.spec.ts","",""
"","7962","should have all required appointment access elements visible @smoke","Chromium","Mon Apr 06 01:33:59 CEST 2026","failed","Mon Apr 06 01:34:07 CEST 2026","LoginPage - UI Tests","tests\loginTests.spec.ts","",""
"","7330","should display profile icon on home page @smoke @regression","Chromium","Mon Apr 06 01:32:59 CEST 2026","passed","Mon Apr 06 01:33:06 CEST 2026","HomePage - Navigation Tests","tests\homePageTests.spec.ts","",""
"","2434","should have all required login elements visible @smoke","Chromium","Mon Apr 06 01:33:48 CEST 2026","passed","Mon Apr 06 01:33:50 CEST 2026","LoginPage - UI Tests","tests\loginTests.spec.ts","",""
"","16355","should upload a new document and verify it appears in the list @smoke @regression","Chromium","Mon Apr 06 01:32:47 CEST 2026","passed","Mon Apr 06 01:33:03 CEST 2026","Documentation - Upload and Download Document Tests","tests\documentation\documentationTests.spec.ts","",""
"","30385","should navigate to password recovery page @regression","Chromium","Mon Apr 06 01:34:08 CEST 2026","broken","Mon Apr 06 01:34:38 CEST 2026","LoginPage - Password Recovery Tests","tests\loginTests.spec.ts","",""
"","30463","should add a new user with Spanish language and verify it appears in the list @regression","Chromium","Mon Apr 06 01:33:18 CEST 2026","broken","Mon Apr 06 01:33:49 CEST 2026","Users - Add User Tests","tests\users\usersTests.spec.ts","",""
"","11690","should search for a non-existent template and verify no results @regression","Chromium","Mon Apr 06 01:33:05 CEST 2026","passed","Mon Apr 06 01:33:16 CEST 2026","Templates - Search Tests","tests\templates\templatesTests.spec.ts","",""
"","7351","should verify footer links are present @regression","Chromium","Mon Apr 06 01:33:50 CEST 2026","failed","Mon Apr 06 01:33:58 CEST 2026","LoginPage - UI Tests","tests\loginTests.spec.ts","",""
"","11118","should search for a non-existent institution and verify no results @regression","Chromium","Mon Apr 06 01:33:07 CEST 2026","passed","Mon Apr 06 01:33:18 CEST 2026","Institutions - Search Tests","tests\institutions\institutionsTests.spec.ts","",""
"","30384","should toggle password visibility @regression","Chromium","Mon Apr 06 01:34:39 CEST 2026","broken","Mon Apr 06 01:35:10 CEST 2026","LoginPage - Password Visibility Tests","tests\loginTests.spec.ts","",""
"","5540","should display error with empty username @regression","Chromium","Mon Apr 06 01:33:07 CEST 2026","passed","Mon Apr 06 01:33:13 CEST 2026","LoginPage - Validation Tests","tests\loginTests.spec.ts","",""
"","20023","should create a new institution and verify it appears in the list @smoke @regression","Chromium","Mon Apr 06 01:32:47 CEST 2026","passed","Mon Apr 06 01:33:07 CEST 2026","Institutions - Create Institution Tests","tests\institutions\institutionsTests.spec.ts","",""
"","30423","should edit an existing user name and verify the change @regression","Chromium","Mon Apr 06 01:35:24 CEST 2026","broken","Mon Apr 06 01:35:55 CEST 2026","Users - Edit User Tests","tests\users\usersTests.spec.ts","",""
"","30389","should create a user, search by name, and verify result @regression","Chromium","Mon Apr 06 01:34:21 CEST 2026","broken","Mon Apr 06 01:34:52 CEST 2026","Users - Search Tests","tests\users\usersTests.spec.ts","",""
"","7240","should have accessible profile dropdown @regression","Chromium","Mon Apr 06 01:33:06 CEST 2026","passed","Mon Apr 06 01:33:13 CEST 2026","HomePage - User Profile Tests","tests\homePageTests.spec.ts","",""
"","28101","should add a new user with English language and verify it appears in the list @smoke @regression","Chromium","Mon Apr 06 01:32:47 CEST 2026","failed","Mon Apr 06 01:33:15 CEST 2026","Users - Add User Tests","tests\users\usersTests.spec.ts","",""
"","5905","should display error with empty credentials @regression","Chromium","Mon Apr 06 01:33:01 CEST 2026","passed","Mon Apr 06 01:33:07 CEST 2026","LoginPage - Validation Tests","tests\loginTests.spec.ts","",""
"","17462","should create a new template and verify it appears in the list @smoke @regression","Chromium","Mon Apr 06 01:32:47 CEST 2026","passed","Mon Apr 06 01:33:04 CEST 2026","Templates - Create Template Tests","tests\templates\templatesTests.spec.ts","",""
"","9543","should search for a non-existent tag and verify no results @regression","Chromium","Mon Apr 06 01:33:04 CEST 2026","passed","Mon Apr 06 01:33:13 CEST 2026","Templates - Tags Search Tests","tests\templates\tagsTests.spec.ts","",""
"","14117","should successfully login with valid credentials @smoke @regression","Chromium","Mon Apr 06 01:32:47 CEST 2026","passed","Mon Apr 06 01:33:01 CEST 2026","LoginPage - Authentication Tests","tests\loginTests.spec.ts","",""
"","30379","should search for a non-existent user and verify no results @regression","Chromium","Mon Apr 06 01:33:50 CEST 2026","broken","Mon Apr 06 01:34:20 CEST 2026","Users - Search Tests","tests\users\usersTests.spec.ts","",""
"","30558","should create and delete a template, then verify it no longer appears @regression","Chromium","Mon Apr 06 01:33:16 CEST 2026","broken","Mon Apr 06 01:33:47 CEST 2026","Templates - Full Lifecycle Tests","tests\templates\templatesTests.spec.ts","",""
"","30505","should create a tag, edit its value, and verify the update @regression","Chromium","Mon Apr 06 01:33:14 CEST 2026","broken","Mon Apr 06 01:33:44 CEST 2026","Templates - Tags Edit Tests","tests\templates\tagsTests.spec.ts","",""
"","28049","should download the uploaded document and verify in File Manager @smoke @regression","Chromium","Mon Apr 06 01:33:04 CEST 2026","passed","Mon Apr 06 01:33:32 CEST 2026","Documentation - Upload and Download Document Tests","tests\documentation\documentationTests.spec.ts","",""
"","30439","should create and delete an institution, then verify it no longer appears @regression","Chromium","Mon Apr 06 01:33:18 CEST 2026","broken","Mon Apr 06 01:33:49 CEST 2026","Institutions - Full Lifecycle Tests","tests\institutions\institutionsTests.spec.ts","",""
